{
  "$schema": "https://json-schema.org/draft/2020-12/schema",
  "$id": "urn:smplwise:arx-exchange:schemas:1:release-manifest",
  "title": "WisKey release manifest (arx-exchange schema 1)",
  "description": "release-manifest.json delivered in ready/<version>/. Strict: unknown fields are rejected; a new field needs schema 2. The Ed25519 signature covers the UTF-8 bytes of the RFC 8785 (JCS) form of the whole object without the top-level 'signature' member, no prehash. JSON with duplicate keys at any depth is rejected before schema validation. Cross-field rules that JSON Schema cannot express are listed in CRITERIA.md and GATE.md and are enforced by the Arx gate.",
  "type": "object",
  "additionalProperties": false,
  "required": [
    "schema",
    "profile",
    "package",
    "domain",
    "install_dir",
    "version",
    "source_commit",
    "zip_sha256",
    "tests_sha256",
    "artifacts_sha256",
    "min_ha_version",
    "tested_ha_versions",
    "contract_version",
    "storage_schemas",
    "requires_ha_restart",
    "breaking",
    "migrations",
    "entities_added",
    "entities_removed",
    "services_changed",
    "ws_commands_added",
    "ws_commands_removed",
    "permissions_added",
    "risk_to_doors",
    "rollback",
    "test_command",
    "python_version",
    "ha_test_version",
    "test_runtime_budget_seconds",
    "tests_excluded",
    "signed_at",
    "signature"
  ],
  "properties": {
    "schema": {
      "const": "arx-exchange/release-manifest/1",
      "description": "Schema identifier and version. Arx rejects any other value."
    },
    "profile": {
      "enum": ["release", "bootstrap"],
      "description": "'release' = signed package for the exchange folder. 'bootstrap' = unsigned package built and tested inside the Arx image only; Arx rejects it on every external path (receipt code R_BOOTSTRAP_PROFILE_EXTERNAL)."
    },
    "package": {
      "const": "smplwise_intercom"
    },
    "domain": {
      "$ref": "#/$defs/ha_domain",
      "description": "Must equal the domain in custom_components/<install_dir>/manifest.json inside the install ZIP. Allowed values are an Arx-local list (today: hikvision_intercom)."
    },
    "install_dir": {
      "$ref": "#/$defs/ha_domain",
      "description": "Arx installs to custom_components/<install_dir>/. Allowed values are an Arx-local list (today: hikvision_intercom)."
    },
    "version": {
      "$ref": "#/$defs/semver",
      "description": "SemVer 2.0 without build metadata (build metadata does not order). Release candidates as X.Y.Z-rc.N."
    },
    "source_commit": {
      "type": "string",
      "pattern": "^([0-9a-f]{40}|[0-9a-f]{64})$",
      "description": "Full lowercase git commit id the package was built from."
    },
    "zip_sha256": { "$ref": "#/$defs/sha256" },
    "tests_sha256": { "$ref": "#/$defs/sha256" },
    "artifacts_sha256": {
      "type": "object",
      "description": "Relative path (inside ready/<version>/) to lowercase SHA-256. Covers every file except the two ZIPs, release-manifest.json and READY.json. Arx verifies each file before showing or using it. A file present in ready/<version>/ but missing from this map is a rejection (R_ARTIFACT_EXTRA).",
      "minProperties": 6,
      "propertyNames": { "$ref": "#/$defs/relpath" },
      "additionalProperties": { "$ref": "#/$defs/sha256" },
      "required": [
        "RELEASE_NOTES.md",
        "ARX_IMPACT.md",
        "tests-manifest.json",
        "contract/CONTRACT_VERSION",
        "contract/ws-commands.json",
        "contract/errors.json",
        "capabilities/capabilities.json"
      ]
    },
    "min_ha_version": { "$ref": "#/$defs/ha_version" },
    "tested_ha_versions": {
      "type": "array",
      "minItems": 1,
      "uniqueItems": true,
      "items": { "$ref": "#/$defs/ha_version" },
      "description": "Exact HA versions actually tested. No wildcards such as 2026.10.x."
    },
    "contract_version": {
      "type": "string",
      "pattern": "^(0|[1-9][0-9]*)\\.(0|[1-9][0-9]*)$",
      "description": "MAJOR.MINOR, equal to contract/CONTRACT_VERSION. Independent of the package version. FORMAT TO_BE_CONFIRMED by WisKey."
    },
    "storage_schemas": {
      "type": "object",
      "description": "One entry per storage store the integration owns, changed or not. Key = store key as used under .storage/. See CRITERIA.md section 3.",
      "minProperties": 1,
      "propertyNames": {
        "type": "string",
        "pattern": "^[a-z][a-z0-9_.]{0,127}$"
      },
      "additionalProperties": { "$ref": "#/$defs/storage_entry" }
    },
    "requires_ha_restart": { "type": "boolean" },
    "breaking": { "type": "boolean" },
    "migrations": {
      "type": "array",
      "items": { "$ref": "#/$defs/migration" },
      "description": "Empty array = no migration. A non-empty list is never installed automatically."
    },
    "entities_added": { "$ref": "#/$defs/name_list" },
    "entities_removed": { "$ref": "#/$defs/name_list" },
    "services_changed": { "$ref": "#/$defs/name_list" },
    "ws_commands_added": { "$ref": "#/$defs/name_list" },
    "ws_commands_removed": { "$ref": "#/$defs/name_list" },
    "permissions_added": { "$ref": "#/$defs/name_list" },
    "risk_to_doors": {
      "enum": ["none", "low", "high"],
      "description": "See CRITERIA.md section 2. Automatic install (if the owner enabled it) only for 'none'."
    },
    "rollback": { "$ref": "#/$defs/rollback" },
    "test_command": {
      "type": "string",
      "minLength": 1,
      "maxLength": 1000,
      "description": "Exact command run inside the gate sandbox, for example: python -m pytest -q -o addopts=\"\" -p no:cacheprovider --junitxml=<report>"
    },
    "python_version": {
      "type": "string",
      "pattern": "^3\\.(0|[1-9][0-9]*)(\\.(0|[1-9][0-9]*))?$"
    },
    "ha_test_version": {
      "$ref": "#/$defs/ha_version",
      "description": "HA version installed in the gate environment (from requirements-ha-test.txt)."
    },
    "test_runtime_budget_seconds": {
      "type": "integer",
      "minimum": 1,
      "maximum": 1800,
      "description": "Measured runtime budget of the test command. Upper bound 1800 is an Arx proposal, TO_BE_CONFIRMED."
    },
    "tests_excluded": {
      "type": "integer",
      "minimum": 0,
      "description": "Number of test cases not delivered to the Arx gate. Must equal the length of tests-manifest.json 'excluded'."
    },
    "signed_at": {
      "type": "string",
      "description": "RFC 3339 UTC with Z, whole seconds, the real signing time of the release event. Display and audit only; never used for trust, ordering or expiry. Empty string only in the bootstrap profile."
    },
    "signature": {
      "description": "Signature object in the release profile; null only in the bootstrap profile.",
      "oneOf": [
        { "$ref": "#/$defs/signature" },
        { "type": "null" }
      ]
    }
  },
  "allOf": [
    {
      "if": { "properties": { "profile": { "const": "release" } } },
      "then": {
        "properties": {
          "signed_at": { "$ref": "#/$defs/utc_seconds" },
          "signature": { "$ref": "#/$defs/signature" }
        }
      }
    },
    {
      "if": { "properties": { "profile": { "const": "bootstrap" } } },
      "then": {
        "properties": {
          "signed_at": { "const": "" },
          "signature": { "type": "null" }
        }
      }
    },
    {
      "if": {
        "anyOf": [
          { "properties": { "ws_commands_removed": { "minItems": 1 } } },
          { "properties": { "entities_removed": { "minItems": 1 } } }
        ]
      },
      "then": { "properties": { "breaking": { "const": true } } },
      "description": "Removing a WS command or an entity is always breaking (CRITERIA.md 1.1)."
    },
    {
      "if": {
        "properties": { "migrations": { "minItems": 1 } }
      },
      "then": {
        "properties": { "rollback": { "properties": { "method": { "const": "restore_ha_backup" } } } }
      },
      "description": "Any migration requires rollback by HA backup restore (CRITERIA.md 5)."
    }
  ],
  "$defs": {
    "sha256": {
      "type": "string",
      "pattern": "^[0-9a-f]{64}$"
    },
    "semver": {
      "type": "string",
      "maxLength": 64,
      "pattern": "^(0|[1-9][0-9]*)\\.(0|[1-9][0-9]*)\\.(0|[1-9][0-9]*)(-(0|[1-9][0-9]*|[0-9]*[A-Za-z-][0-9A-Za-z-]*)(\\.(0|[1-9][0-9]*|[0-9]*[A-Za-z-][0-9A-Za-z-]*))*)?$"
    },
    "ha_version": {
      "type": "string",
      "pattern": "^20[2-9][0-9]\\.([1-9]|1[0-2])\\.(0|[1-9][0-9]*)$",
      "description": "Exact HA CalVer YEAR.MONTH.PATCH. Pre-release HA versions are not accepted."
    },
    "ha_domain": {
      "type": "string",
      "pattern": "^[a-z][a-z0-9_]{1,62}$"
    },
    "relpath": {
      "type": "string",
      "maxLength": 255,
      "pattern": "^[A-Za-z0-9_][A-Za-z0-9_.-]*(/[A-Za-z0-9_][A-Za-z0-9_.-]*)*$",
      "description": "Relative POSIX path. No leading slash, no backslash, no '.' or '..' segment, no empty segment, no hidden file."
    },
    "utc_seconds": {
      "type": "string",
      "pattern": "^[0-9]{4}-(0[1-9]|1[0-2])-(0[1-9]|[12][0-9]|3[01])T([01][0-9]|2[0-3]):[0-5][0-9]:[0-5][0-9]Z$"
    },
    "name_list": {
      "type": "array",
      "uniqueItems": true,
      "items": { "type": "string", "minLength": 1, "maxLength": 255 }
    },
    "signature": {
      "type": "object",
      "additionalProperties": false,
      "required": ["algorithm", "key_id", "value"],
      "properties": {
        "algorithm": { "const": "Ed25519" },
        "key_id": {
          "type": "string",
          "pattern": "^[0-9a-f]{64}$",
          "description": "Lowercase hex SHA-256 of the 32 raw public key bytes. Arx trusts only keys pinned and approved on the Arx side, never a key shipped in a package."
        },
        "value": {
          "type": "string",
          "pattern": "^[A-Za-z0-9+/]{86}==$",
          "description": "Standard Base64 (with padding) of the 64-byte Ed25519 signature."
        }
      }
    },
    "storage_entry": {
      "type": "object",
      "additionalProperties": false,
      "required": ["version", "previous_version", "irreversible"],
      "properties": {
        "version": {
          "type": "integer",
          "minimum": 1,
          "description": "Store schema version after this release."
        },
        "previous_version": {
          "type": ["integer", "null"],
          "minimum": 1,
          "description": "Version in the previous published release; null for a store new in this release."
        },
        "irreversible": {
          "type": "boolean",
          "description": "true when data written by this version cannot be read by the previous version."
        },
        "removed": {
          "type": "boolean",
          "default": false,
          "description": "true when this release stops using the store. Removing a store is breaking."
        }
      }
    },
    "migration": {
      "type": "object",
      "additionalProperties": false,
      "required": ["id", "target", "from_version", "to_version", "idempotent", "reversible", "dry_run", "backup_before", "description"],
      "properties": {
        "id": { "type": "string", "pattern": "^[a-z0-9][a-z0-9_.-]{0,63}$" },
        "target": {
          "type": "string",
          "minLength": 1,
          "maxLength": 255,
          "description": "Store key, config-entry, registry or domain that the migration changes."
        },
        "from_version": { "type": ["integer", "string"] },
        "to_version": { "type": ["integer", "string"] },
        "idempotent": { "const": true },
        "reversible": {
          "type": "boolean",
          "description": "false must match irreversible: true in storage_schemas for the same store."
        },
        "dry_run": {
          "const": true,
          "description": "A dry-run mode that reports changes without writing is mandatory."
        },
        "backup_before": {
          "const": true,
          "description": "The migration writes a backup of every file it touches before changing it."
        },
        "description": { "type": "string", "minLength": 1, "maxLength": 2000 }
      }
    },
    "rollback": {
      "type": "object",
      "additionalProperties": false,
      "required": ["method", "text_he", "text_en"],
      "properties": {
        "method": {
          "enum": ["reinstall_previous", "restore_ha_backup"],
          "description": "reinstall_previous only when no store version changed, no migration and breaking is false. Otherwise restore_ha_backup. Arx never downgrades automatically; the bad version goes to the Arx-local blocked_versions list."
        },
        "text_he": { "type": "string", "minLength": 1, "maxLength": 500 },
        "text_en": { "type": "string", "minLength": 1, "maxLength": 500 }
      }
    }
  }
}
